<!ELEMENT schema (types+,fields+,uniqueKey,defaultSearchField,similarity?,solrQueryParser,copyField*)>

<!ATTLIST schema name CDATA #REQUIRED>
<!ATTLIST schema version CDATA #REQUIRED>

<!ELEMENT types (fieldType+)>
<!ELEMENT fieldType (analyzer*)>

<!ATTLIST fieldType name CDATA #REQUIRED>
<!ATTLIST fieldType class CDATA #REQUIRED>
<!ATTLIST fieldType positionIncrementGap CDATA #IMPLIED> 
<!ATTLIST fieldType sortMissingLast (true|false) "true">
<!ATTLIST fieldType omitNorms (true|false) "true">
<!ATTLIST fieldType precisionStep CDATA #IMPLIED>
<!ATTLIST fieldType autoGeneratePhraseQueries (true|false) #IMPLIED>
<!ATTLIST fieldType tokenized (true|false) #IMPLIED>
<!ATTLIST fieldType omitTermFreqAndPositions (true|false) #IMPLIED>
<!ATTLIST fieldType omitPositions (true|false) #IMPLIED>



<!ELEMENT analyzer (tokenizer*,filter*)>
<!ATTLIST analyzer 
  type (index|query) #IMPLIED
  class CDATA        #IMPLIED>

<!ELEMENT tokenizer EMPTY>
<!ATTLIST tokenizer 
   class CDATA #REQUIRED
   group CDATA #IMPLIED
   pattern CDATA #IMPLIED
   isMaxWordLength (true|false) #IMPLIED>
   

<!ELEMENT filter EMPTY>
<!ATTLIST filter class CDATA #REQUIRED>

<!ELEMENT uniqueKey (#PCDATA)>
<!ELEMENT defaultSearchField (#PCDATA)>

<!ELEMENT similarity (str*)>
<!ATTLIST similarity class CDATA #REQUIRED>

<!ELEMENT str (#PCDATA)>
<!ATTLIST str name CDATA #REQUIRED>


<!ELEMENT solrQueryParser EMPTY>
<!ATTLIST solrQueryParser defaultOperator (OR|AND) #REQUIRED>

<!ELEMENT fields (field|dynamicField)+>
<!ELEMENT field  EMPTY>
<!ATTLIST field  name CDATA #REQUIRED>
<!ATTLIST field  type CDATA #REQUIRED>
<!ATTLIST field  indexed (true|false) #IMPLIED>
<!ATTLIST field  stored (true|false) #IMPLIED>
<!ATTLIST field  multiValued (true|false) #IMPLIED>
<!ATTLIST field  required (true|false) #IMPLIED>
<!ATTLIST field  default CDATA #IMPLIED>

<!ELEMENT dynamicField EMPTY>
<!ATTLIST dynamicField  name CDATA #REQUIRED>
<!ATTLIST dynamicField  type CDATA #REQUIRED>
<!ATTLIST dynamicField  indexed (true|false) #IMPLIED>
<!ATTLIST dynamicField  stored (true|false) #IMPLIED>
<!ATTLIST dynamicField  multiValued (true|false) #IMPLIED>
<!ATTLIST dynamicField  required (true|false) #IMPLIED>

<!ELEMENT copyField EMPTY>
<!ATTLIST copyField  source CDATA #REQUIRED>
<!ATTLIST copyField  dest CDATA #REQUIRED>
 
