<?xml version="1.0" ?>
 <!DOCTYPE schema PUBLIC "" "http://terminator.admin.taobao.org:9999/dtd/solrschema.dtd">
<schema name="example core" version="1.1">
	<types>
		<fieldType name="string" class="solr.TextField"
			sortMissingLast="true"></fieldType>

		<fieldType name="int" class="solr.TrieIntField"
			precisionStep="0" positionIncrementGap="0" />

		<fieldType name="tlong" class="solr.TrieLongField"
			precisionStep="8" omitNorms="true" positionIncrementGap="0" />

		<fieldType name="sint" class="solr.SortableIntField"
			sortMissingLast="true" omitNorms="true" />

		<fieldType name="slong" class="solr.SortableLongField"
			sortMissingLast="true" omitNorms="true" />

		<fieldType name="string_ws" class="solr.TextField"
			positionIncrementGap="100">
			<analyzer>
				<tokenizer class="solr.WhitespaceTokenizerFactory" />
			</analyzer>
		</fieldType>

		<fieldType name="string_sd" class="solr.TextField"
			sortMissingLast="true" omitNorms="true">
			<analyzer type="index">
				<tokenizer class="solr.StandardTokenizerFactory" />
				<filter class="solr.ChineseFilterFactory" />
				<filter class="solr.LowerCaseFilterFactory" />
			</analyzer>
			<analyzer type="query">
				<tokenizer class="solr.StandardTokenizerFactory" />
				<filter class="solr.ChineseFilterFactory" />
				<filter class="solr.LowerCaseFilterFactory" />
			</analyzer>

		</fieldType>

		<fieldType name="tint" class="solr.TrieIntField"
			precisionStep="8" omitNorms="true" positionIncrementGap="0" />
		<fieldType name="tfloat" class="solr.TrieFloatField"
			precisionStep="8" omitNorms="true" positionIncrementGap="0" />
		<fieldType name="sfloat" class="solr.SortableFloatField"
			sortMissingLast="true" omitNorms="true" />

	</types>

	<fields>
		<field name="id" type="slong" indexed="true" stored="true"
			multiValued="false" required="true" />
		<field name="userId" type="slong" indexed="true" stored="true"
			multiValued="false" />
		<field name="userNick" type="string" indexed="true" stored="true"
			multiValued="false" />
		<field name="title" type="string_sd" indexed="true" stored="true"
			multiValued="false" />
		<field name="contentKey" type="string" indexed="true" stored="true"
			multiValued="false" />
		<field name="coverPicpath" type="string" indexed="true" stored="true"
			multiValued="false" />
		<field name="itemId" type="string" indexed="true" stored="true"
			multiValued="false" />
		<field name="gmtCreated" type="slong" indexed="true" stored="true"
			multiValued="false" />
		<field name="gmtModified" type="slong" indexed="true" stored="true"
			multiValued="false" />
		<field name="tag" type="string_sd" indexed="true" stored="true"
			multiValued="false" />
		<field name="aScore" type="sfloat" indexed="true" stored="true"
			multiValued="false" />
		<field name="count" type="int" indexed="true" stored="true"
			multiValued="false" />
		<field name="feedId" type="string" stored="true" multiValued="false" />
		<field name="summary" type="string_sd" indexed="true" stored="true"
			multiValued="false" />
		<field name="status" type="int" indexed="true" stored="true"
			multiValued="false" />

		<dynamicField name="*-t" type="text_com" stored="false"
			indexed="true" />

	</fields>

	<uniqueKey>id</uniqueKey>
	<defaultSearchField>id</defaultSearchField>

	<similarity class="com.taobao.terminator.core.solrx.PayloadSimilarity">
		<str name="func">max</str>
	</similarity>

	<solrQueryParser defaultOperator="OR" />
	<copyField source="prov" dest="location" />
</schema>